{
  "accountability_share": 0.1,
  "automation_rate": 0.88,
  "customer_access_requirement": 0.7,
  "customer_segment": "global self-serve users",
  "demand_growth_rate": 0.12,
  "distribution_requirement": 0.85,
  "entry_cost": 4000,
  "evidence_notes": [
    "Synthetic opportunity used for mechanism testing."
  ],
  "funded_slots_12m": 180,
  "local_context_share": 0.12,
  "local_execution_requirement": 0.0,
  "marketing_certainty": 0.88,
  "new_supply_12m": 5000,
  "opportunity_id": "generic-ai-microsaas",
  "physical_world_share": 0.0,
  "price_per_outcome": 300,
  "qualified_supply_now": 1500,
  "regulatory_requirement": 0.0,
  "remaining_lifetime_months": 12,
  "required_transformations": {
    "D->D": 0.0,
    "D->I": 0.72,
    "D->K": 0.0,
    "D->P": 0.0,
    "D->W": 0.0,
    "I->D": 0.0,
    "I->I": 0.0,
    "I->K": 0.7,
    "I->P": 0.0,
    "I->W": 0.0,
    "K->D": 0.0,
    "K->I": 0.0,
    "K->K": 0.0,
    "K->P": 0.0,
    "K->W": 0.42,
    "P->D": 0.0,
    "P->I": 0.0,
    "P->K": 0.0,
    "P->P": 0.48,
    "P->W": 0.0,
    "W->D": 0.0,
    "W->I": 0.0,
    "W->K": 0.0,
    "W->P": 0.4,
    "W->W": 0.0
  },
  "required_weekly_hours": 18,
  "supply_growth_rate": 1.2,
  "time_to_first_revenue_months": 7,
  "title": "Generic AI micro-SaaS builder",
  "top10_supplier_share": 0.78,
  "training_price": 800,
  "training_seats_marketed": 12000,
  "trust_requirement": 0.35,
  "variable_cost_per_outcome": 120
}
